Title,Author(s),Published Date,Publisher
I improve sing.,"Robert Martin, Tracey Boyd",2011-10-18,Curtis LLC
Only gas yourself.,"John Bautista, Stacey Gomez",2020-01-01,Fisher PLC
Answer peace myself tough.,"Linda Martinez, Martin Henry",2008-01-23,Collins-Daniels
Minute rule glass way.,"Alexis Brown, Steve Good",2024-08-13,"Lee, King and Green"
Behavior all these.,"Patrick Knapp, Amy Dunlap",2016-12-23,Carpenter-Byrd
Character study.,"Kenneth Lewis, Matthew Johnson",2025-01-02,Gonzalez PLC
Budget street newspaper player defense.,"Kevin Strong, Ann Sims",2007-06-01,"Potts, Vasquez and Franco"
To style security.,"Adam Young, Tony Gonzales",2020-01-14,Hammond LLC
Red raise.,"Rebecca Williams, Matthew Rice",2013-12-21,"Coleman, Diaz and Parks"
Look art movement people.,"Shannon Johnson, Laura Sawyer",2003-10-24,"Shaw, Miller and Davis"
Fear bill Republican later author.,"Kathleen Sanchez, Erika Callahan",2024-12-30,Walton PLC
Left same.,"Kurt Chavez, Melanie Peterson",2015-08-02,Garrett-Howard
Tend page country.,"Michael Garcia, Allison Anderson",2004-08-03,Howard and Sons
Scene report.,"Diane Welch, Catherine Mercer",2010-05-08,Benton-Fuentes
Inside science board.,"Adam Espinoza, Brian Morrison",2006-08-11,Jackson-Grant
Garden something mention final.,"Chelsey Luna, Steven Barrera",2023-04-02,"Goodman, Rodgers and Moran"
Term difference prepare nor American.,"Tyrone Lin, Kevin Carpenter",2005-08-09,Campbell PLC
Sometimes class build just.,"Sarah Villarreal, Nancy Leon",2018-10-14,"White, Simpson and Valenzuela"
Edge say major commercial.,"Linda Sanchez, Kimberly Morgan",2011-12-11,Ferguson Group
Thousand seat century.,"Michelle Campbell MD, Rhonda Wheeler",2015-09-07,Rivera-Martinez
Determine pressure live.,"Michael Kane, Richard Huynh",2014-07-09,Morrison PLC
Area answer nothing.,"Cody Gomez, Brian Mosley",2008-05-04,"Morris, Kelly and Dunn"
Board well appear start.,"Phyllis Stewart, Dwayne Turner",2001-07-25,Smith-Woods
Dinner law couple.,"Christy Vaughn, Wesley Brown",2024-12-29,"Murillo, Robles and Lawson"
State building agree wish head.,"Donald Johnson Jr., Monica Bradley",2016-06-01,"Jones, Powell and Townsend"
Cup say can the.,"Joshua Carter, Eugene Brown",2012-11-21,Mcintosh LLC
Likely company hundred various.,"James Jennings, Jamie Snyder",2020-08-29,Blair-Barker
Suddenly relate least PM ability.,"Anita Jackson DDS, Brittany Robinson",2004-07-14,George-Murray
Again entire as save.,"Bryan Moses, Christopher Young",2021-01-25,Roman PLC
Anyone establish cover.,"Miranda Davis DVM, Ms. Ashley Blair",2015-09-12,Smith Ltd
Fill open many you.,"Lori Jones, Joseph Perry",2017-02-04,"Garcia, Ruiz and Lyons"
Cold wish pick.,"Ashley Murphy, Benjamin Mcdonald",2000-01-31,Carlson PLC
Recognize must away still street.,"Brandy Johnson, Linda Valenzuela",2008-08-11,"Weiss, Castillo and Turner"
Itself source worry family.,"Loretta Knight, Lori Schultz",2009-08-10,"Lucas, Massey and Curtis"
Live current rather.,"Brandi Burton, Nathan Mcgrath",2004-09-08,Mckay-Joyce
Idea population soldier.,"Mrs. Julia Carpenter, Kyle Brown",2024-01-21,Green and Sons
Have look.,"Adrienne Thompson, Stacy Garcia",2003-03-01,Pitts-Morgan
Already agency.,"David Webb, John Woodward",2024-02-27,"Rivera, Wells and Wolf"
Discussion year style both.,"Angelica Tran, Jose Miles",2018-12-22,"Smith, Tran and Mcfarland"
Magazine foot laugh.,"Kathryn Burton, John Gibson",2015-09-13,"Allen, Martinez and Stewart"
Market anything forward.,"Rachel Cooley, Timothy Williams",2000-09-11,Robles Ltd
Expect investment move statement black.,"Daniel Ray, Sabrina Davis",2001-10-14,Garcia-King
Both TV play.,"Chelsea Daniels, Robert Fisher",2003-08-19,Herrera LLC
Fire pass.,"Christopher Middleton, Dale Warren",2015-04-24,Richmond Ltd
Choose money.,"David Peterson III, Danielle Mitchell",2008-10-24,Burns-Bauer
Out tend chair.,"Michael Cox, Kristen Velasquez",2021-12-04,"Arnold, Holmes and Stephens"
Continue person technology ask cause.,"Ryan Turner, Megan Smith",2025-01-26,Chapman Ltd
Still message cause.,"Brooke Briggs, Gregory Hill",2024-02-28,Walsh Group
Standard rock forward recently.,"Susan Wilkins, Richard Holloway",2024-04-05,"Evans, Silva and Vincent"
Wind deep.,"Robert Palmer, Curtis Yang",2019-09-08,Singh Inc
Cut before.,"Chelsey Alvarez, Justin Miller",2020-06-08,Cowan Inc
Adult within bed cut.,"Mrs. Heather Gutierrez, Cindy Montoya",2023-11-02,"Johnson, Washington and Franco"
Protect perform leader.,"Chase Wagner, Melanie Cole",2015-11-11,Johnson-Paul
Final speak issue almost.,"Lisa Graves, Amy Stanley",2004-12-16,Frazier-Hebert
Audience close east quality.,"Thomas Maxwell, Jason Hunt",2011-05-04,Valenzuela-Huerta
Add woman early participant.,"Jason Dean, Randall Wright",2017-05-16,"Anderson, Smith and Phelps"
Woman stop read debate.,"Denise Smith, Susan Brewer",2019-01-11,Watts Inc
Material usually him single.,"Jeffrey Hawkins, Amber Cunningham",2023-08-15,"Weeks, Hogan and West"
Need low right trial.,"Tammie Spencer, Anthony Collins",2004-08-02,Taylor-Franklin
Office listen quite.,"Michelle West, Wayne Brown MD",2007-11-30,Williams PLC
Trip enough treatment.,"Lisa Martinez, Bethany Cardenas",2004-12-10,Copeland LLC
Hand run power result hotel.,"Dana Smith, Jeffery Clark",2007-02-28,Howell Group
Event mouth.,"Michael Coleman, Teresa Orr",2016-08-04,Rowe LLC
Appear usually skin new.,"James Charles, Jennifer Mercado",2015-11-04,Morrison PLC
Or site bill.,"Steven Barton, Michael Kim",2024-03-24,"Williams, Smith and Miller"
Subject herself about more.,"Sabrina Cooper, Benjamin Arnold",2010-12-21,"Blackburn, Gonzales and Chen"
Black land individual.,"Jennifer Walker, Heather Lucas",2005-01-08,Hernandez and Sons
Get image region look Mrs.,"Rose Frey, Joseph Morris",2013-01-28,Patterson-Jones
Marriage music medical.,"James Herrera, James Holt",2013-05-09,"Norton, Alexander and Rowland"
Strategy baby commercial.,"Tiffany Stuart, William Smith",2014-06-30,Munoz-Ferguson
Expert fire.,"Jordan Anderson, Stephanie Leon",2017-04-23,Barron-Martinez
Practice attack cell from though.,"Theodore Davis, Elizabeth Combs",2017-07-22,Johnson LLC
Assume light until fast.,"Edward Nelson, Robert Tran",2011-08-15,Lee LLC
Throw best culture thought behind.,"Shannon Mcdonald, Gina Gibson",2016-06-09,Dawson Inc
Check opportunity measure clearly.,"Katie Hicks, Thomas White",2000-07-18,Rhodes Group
Leader history feel sound cost.,"Patrick Marquez, Cynthia Nguyen",2011-09-24,Phillips LLC
Rich term.,"Michael Stephens, Janice Campbell",2007-11-16,Kennedy-Bruce
Necessary son part organization these.,"Samuel Kim, Annette Bryant",2002-04-03,Johnson-Lopez
Hold born author.,"Teresa Levy, Sarah Sanford",2004-01-17,"Price, Francis and Rivas"
Letter which beyond.,"Michael Cunningham, Miranda Hill",2019-09-08,Brown Group
Religious past science according.,"Christina Brown, Ashley Martinez",2008-11-03,Parker-Payne
Likely kitchen.,"Garrett Grimes, Michelle Lopez",2015-01-23,Sellers-Brooks
Behind activity.,"Mario Moore, Taylor Henry",2011-09-10,Rowland PLC
Seek street manage.,"Connor Baker, Amanda Miller DVM",2019-02-23,"Dean, Christensen and Price"
Price current.,"Sherri Lawrence, Dennis Hill",2007-01-26,Molina-Mitchell
Together same allow.,"Tim Gordon, Craig Graves",2022-09-12,Jackson-Rojas
Him sell.,"Charles Hernandez, Michael Patton",2005-03-22,Pratt PLC
Its Mrs election throughout safe.,"Carmen Andrews, Courtney Hawkins",2002-09-17,"Ramos, Marsh and Simon"
Opportunity character notice tell establish.,"Nicole Martinez, Daniel Atkins",2022-05-22,"Graham, Turner and Hernandez"
Leader ready policy plant.,"Lawrence Johnson, Diana Park",2003-08-27,Taylor Inc
Everybody million father do.,"Mark Torres, Anthony Miller",2021-04-16,"Williams, Rodriguez and Wade"
Ball we way especially.,"Tracy Day, Heather Poole",2001-04-06,Hall Inc
College white.,"Kristine Nichols, David Roth",2023-06-06,Lutz-Ferguson
Use traditional plan source.,"Perry Lopez, Lee Allen",2009-09-26,Cole-Gibson
Not when deal.,"Nicholas Phillips, David Young",2016-12-22,"Flores, Medina and Berger"
Mind network.,"Rachel Bell, Elizabeth Reilly",2003-09-14,Flores-Fox
Positive beautiful manage probably.,"Kevin Curry, Robert Robinson",2002-12-21,Jackson PLC
Read avoid impact.,"Thomas Stevenson, Todd Lucero",2023-08-30,Ramirez Ltd
Gas chance policy.,"Miguel Hardy, Kendra Nguyen",2012-08-22,Harvey LLC
Two much type improve.,"Tracy Gonzalez, Lonnie Collier",2015-10-28,Richardson PLC
Foot particularly.,"Heather Hogan, Erik Rivera PhD",2014-09-05,Carroll Inc
Second throw.,"Whitney Mitchell, Lisa Savage",2014-05-03,"Powell, Robles and Jensen"
Themselves race raise.,"Michelle Bauer, Mrs. Amber Rodriguez",2012-07-03,"Mccarthy, Smith and Hobbs"
Food idea girl.,"Stephanie Stokes, Kevin Fletcher",2014-12-26,"Casey, Garner and Melton"
Fact apply agent.,"Sharon Martin, Jeremy Henderson",2014-10-03,Gordon Group
Through chair finally eat again.,"Philip Holder, Andre Sandoval",2018-08-01,Johnson-Bowen
Focus save admit.,"Jennifer Weaver, Mr. David James",2021-04-12,"Bailey, Savage and Gross"
Whatever cold along Mrs.,"Richard Trevino, Joshua Campbell",2011-06-29,Patrick-Parker
Painting suggest throw imagine.,"Christopher Chase, Brent Villanueva",2012-02-27,Smith PLC
Political college audience.,"Linda Green, Robert Turner",2003-09-20,Paul LLC
Figure lose.,"Erica King, Adrienne Ingram",2013-03-08,Morgan LLC
Place instead.,"Angela King, Randy Young",2011-04-13,"Dalton, Crawford and Martin"
Paper sense authority break such.,"Katie Fischer, Melissa Walker",2021-11-17,Pratt-Turner
Pick keep.,"Lorraine Hendrix, Rachel Woods",2010-11-02,Mccarthy-Jones
Away series concern.,"Kristen English, Kimberly Gaines",2018-12-09,"Castillo, Jones and Freeman"
Commercial fill most upon strategy.,"Stephen Reynolds, Rebecca Benson",2010-06-05,"Deleon, Casey and Palmer"
Fine her floor.,"Alexander Knight, Mary Lopez",2005-07-28,Hinton Group
Decision east debate leave great.,"Carla Hernandez, Jason Kennedy",2015-07-04,Newton-Simmons
Beautiful assume.,"Lori Carter, Stephanie Davis",2005-02-04,"Chan, Andrews and Payne"
Data magazine right little election.,"Michael Russell, Robert Beard",2014-07-21,Marquez-Castillo
Art how.,"Jeffrey Carson, Ronald Garcia",2002-03-30,Baldwin-Adams
Feel now.,"Leslie Howard, William Perry",2006-12-08,"Meza, Jones and Evans"
Mind determine near nor.,"Mark Turner, Shane Graves",2005-01-21,Gray Group
Reality that government.,"Jonathan Johnson, Tanya Nguyen",2002-05-29,Sweeney-Lloyd
Strong billion board blue.,"Kevin Ayala, Amy Little",2020-03-07,Mcbride-Aguilar
Our attack second nature green.,"Michelle Mathews, Adam Jimenez",2009-04-06,Johnson and Sons
Evening face system.,"Nathaniel Case, Charles James",2012-06-24,Bowen and Sons
Within no lot.,"James Mora, Suzanne Figueroa",2012-06-28,Wilcox Group
National whatever prepare.,"Jenna Johnson, Christopher Robertson",2001-09-05,Hamilton-Moyer
Record detail expert.,"Taylor Small, Selena Walker",2015-08-14,"Watkins, Mathews and Murray"
Yet make theory key.,"Madeline Jones, Jacob Campbell",2004-07-31,"Thompson, Pearson and Kennedy"
Daughter short.,"Jamie Acevedo, Kathryn Fernandez",2022-08-14,Cunningham-Thomas
Happy town yard which fine.,"Michele Hobbs, Kathy Fernandez",2002-12-31,"Young, Watson and Cortez"
Hit wife hot already.,"Charles Adams, James Grant",2002-11-01,Smith Ltd
Side fact standard special.,"Theresa Russo, Erik Thomas",2001-08-14,"Johnson, Cobb and Contreras"
Represent myself fight present.,"Justin Phillips, Kevin Carlson",2019-01-14,Ward Inc
On before.,"Gordon Munoz, Phillip Hernandez",2010-11-01,"Hernandez, Jimenez and Gomez"
Game buy religious yard.,"Valerie Leonard, Alicia Gomez",2006-07-08,Howe and Sons
Success stay space fact.,"Michael Morrison, Michele Williams",2012-06-17,"Miller, Brown and Martinez"
Guess eight general debate because.,"Jesse Morgan, Angela Warner",2012-06-19,Carpenter-Wade
How trouble imagine news.,"Kim Romero, Richard Crawford",2002-04-19,"Chavez, Herrera and Garrett"
Believe material cell.,"James Garcia, Rodney Evans",2001-12-01,Arnold-Clarke
End out industry trouble.,"Victoria Scott DDS, Regina Dalton",2018-11-27,Vaughn Group
Have year contain out.,"Nicole Wilson, Billy Bennett",2007-10-06,Gray-Thompson
Meeting food then thought top.,"Tony Walker, Lisa Drake DDS",2018-02-16,"Cabrera, Sanders and Young"
Activity listen garden.,"Chelsea Erickson, Robert Fox",2015-11-16,"Arnold, Lucas and Johnson"
Window tax including work loss.,"David Sanchez, Brenda Lee",2015-02-21,Guerra-Wells
Affect method help the.,"Dana Greer, Samantha Guzman",2019-01-30,White Inc
Most school.,"Susan Finley, James Russell",2004-05-28,Reynolds PLC
Drop far account under.,"Beth Berry, Christopher Richards",2006-11-13,Woodard PLC
Follow he production.,"Kevin Mcgrath, Thomas Smith",2009-07-30,"Hernandez, Hoffman and Saunders"
Bill return.,"Brenda Green, Leslie Garza",2025-01-23,Owens-Simmons
Rest agency.,"Corey Farmer, Amanda Jones",2019-06-09,Kent-Miller
Effect you it term.,"Matthew Hardin, Xavier Cunningham",2008-01-02,"Hayden, Johnson and Kemp"
Total industry technology there.,"Raymond Velazquez, Megan Weber",2001-07-18,"Kim, Rocha and Roberts"
Any station.,"Daniel Curry, Katie Williams",2024-11-06,"Thomas, Harrington and Banks"
Government trade ten fine.,"Shannon Graves, Cory Simpson",2023-06-23,"Davis, Garcia and Butler"
Result develop bit teacher simply.,"John Schwartz, Jared Anderson",2021-07-20,"Howard, Silva and Harding"
Partner economic other.,"Mr. Jimmy Williams Jr., Christina Johnson",2006-05-18,Hamilton PLC
Budget suddenly decision.,"Kimberly Church, Madison Lopez",2007-11-17,"Smith, Spencer and Morgan"
Agree around national.,"Joseph Rojas, Michael Shaw",2012-06-24,"May, White and Kim"
Program teacher reality see.,"Robert Reyes, Edward Taylor",2007-04-18,"Phillips, Spence and Gonzalez"
Involve role scientist.,"Charles Thornton, Carla Arellano",2021-03-10,Clark LLC
Degree free doctor though.,"Christopher Thornton, Tammy Hoffman",2024-10-07,Smith LLC
Sell back hit magazine.,"Sarah Jones, Debra Lee",2014-01-20,"Delgado, Peterson and Robinson"
Person old wish.,"Anthony Sanders, Alexis Dunn",2021-03-08,"Smith, Woods and Love"
Piece population edge.,"Mr. Brandon Stewart, Luis Roth",2001-04-25,Hudson Inc
Company imagine any.,"Maria James, Rachel Wade",2021-10-13,Sanchez Group
Chair rest include economy dog.,"Jennifer Phillips, Denise Davis",2007-08-19,"Hensley, Jones and Brown"
Win common.,"Joanne Caldwell, Eric Cherry",2014-12-27,"Davis, Nielsen and Phillips"
Site raise relate significant while.,"Philip Young, James Thomas",2011-03-06,"Anthony, Harris and Wong"
Team perhaps recently way.,"Lindsay Lane, Stephen Jones",2002-05-07,Faulkner-Malone
Answer should quite hold.,"Patricia Strickland, Barbara Jackson",2013-10-18,Turner Ltd
Any bar available blood.,"Manuel Nguyen, Cheryl Owens",2018-11-20,"Sims, Olson and Jones"
Talk much.,"Spencer Jones, James Harris",2000-05-03,Benton-Vega
Fish everything player cost.,"Aaron Barnes, Joseph Mcdonald",2020-07-04,Hill-Johnson
Modern follow whether great.,"Nicole Fox, Mr. David Lee",2005-11-27,Collier PLC
Cost contain three brother simple.,"Peter Robertson, Anthony Rowe",2018-03-11,Williams-Carrillo
Fish do consumer middle.,"Lisa Watson, Cristian Shaffer Jr.",2020-07-13,Scott Inc
Movement for interesting young.,"Carla Nelson, Rebekah Walsh",2020-08-26,"Clark, Clark and Morales"
Author get statement personal worker.,"Jacob Spencer, Marilyn Mccarthy",2002-06-15,"Conner, Simon and Roth"
Theory film.,"Isaac Vargas, Austin Davis",2016-04-12,"Martin, Ray and Davis"
Yard smile past.,"Thomas Young, Sydney Brooks",2001-11-29,Hill Ltd
Right concern professional positive create.,"John Sherman, Tiffany Perez",2014-01-03,King PLC
Follow east.,"Emily Johnson, Jamie Brooks",2001-10-19,Bonilla-Martinez
Stock represent sign carry.,"Justin Smith, Ashley Wright",2020-08-09,Martin Ltd
Operation dark party.,"Scott Sandoval, Brenda Sims",2011-02-14,Carroll Ltd
Beyond agreement service late.,"Jackie Donovan, Jennifer Walker",2000-02-10,Jackson-Gordon
Too member future.,"Michelle Harris, Zachary Garcia Jr.",2001-11-28,Buchanan Ltd
Song decade.,"Kathleen Martin, Melanie Evans",2006-07-26,"Martinez, Henson and Gilbert"
Area fill.,"Preston Waters, Mark Parker",2002-11-04,Aguilar-Brown
Behind heart likely world research.,"Andrew Campbell, Rachel Vargas",2015-03-26,Terrell-Chavez
Future smile force push activity.,"Clifford Graves, Brandon Hernandez",2011-08-18,Manning-Bradford
Think bill business.,"Kimberly Payne, Jeffrey Ramirez",2008-01-14,Austin Group
Beyond think grow simple economy.,"Jonathan Watson, Diana Howard",2023-06-14,Williams LLC
Which lose store tree.,"Julie Frey, Shannon Bradley",2018-12-22,"Fitzpatrick, Wilson and Luna"
Discussion him.,"Annette Shaw, Marvin Hernandez",2017-08-05,Boyd LLC
Hold such TV seem.,"Mr. Jeffery Roberts, Robert Robles",2010-05-01,"Hicks, Black and Rice"
This Republican current blood.,"Stephanie Booth, Jacob Jimenez",2021-07-27,"Porter, Thomas and Nelson"
Issue century keep important front.,"Martin Hall MD, Heather Jacobs",2015-01-14,"White, Diaz and Wright"
Sound skin sit.,"Andrew Hamilton, Lauren Griffin",2009-09-20,Peterson-Walker
Fund writer drive.,"Sandra Salazar, Autumn Roberts",2020-05-25,"Mason, Mathis and Robinson"
Parent quite board.,"Michael Wright, Daniel Gibson",2012-04-30,Yang-Palmer
Prove develop particular mouth.,"Mark White, Charles Mora",2023-05-12,"Brown, Lowe and Harmon"
Probably consider.,"Kristin Martinez, Zachary Franklin",2017-03-11,"Campbell, Bauer and Morse"
Necessary line painting computer.,"Dr. Ashley Lee DVM, Emily Parker",2007-01-16,Wade-Ayala
Table occur music morning man.,"Monica Banks, Stacey Montoya",2022-07-04,Cook-Christensen
Yet better effort everyone.,"Lawrence Davis, Alyssa Wiley",2019-09-13,Moore and Sons
Cup city think blood.,"William Carr, Timothy Clayton",2019-08-20,Hubbard-Thompson
Form on several.,"Adam Evans, Jose Whitaker",2016-04-04,"Strong, Meyer and Williams"
Lead while idea debate service.,"Sean Olsen, Kyle Gray",2016-01-22,Powers Inc
Itself floor company perform.,"Sandra Miller, Lisa Flores",2010-01-04,"Bender, Lee and Garcia"
Option approach often point.,"Jonathan Watson, David Castaneda",2019-03-03,"Rubio, Morgan and Smith"
Both moment trade.,"Crystal Jones, Trevor Conrad",2001-06-15,Owen PLC
Program executive level.,"Jeffrey Romero, William Williams",2009-10-31,"Murphy, Stewart and Lawrence"
Yes husband figure.,"Lisa Fernandez, Alexander Thomas",2015-12-12,Hess and Sons
History sport everything.,"Dennis Smith, Elizabeth Stafford",2006-04-18,Taylor PLC
Various season have walk.,"Dawn Lopez, Dominique Byrd",2014-08-11,Cole LLC
Candidate early.,"Randall Randall, Tammy Boyd",2006-10-05,"Lawson, Franco and Cooper"
Gun either often.,"Lindsey Powell, Anthony Carpenter",2004-04-24,"Henderson, Spencer and Parker"
Month southern wear hundred support.,"Jake Hatfield, David Morrison",2013-11-12,"Hicks, Miller and Hernandez"
Physical operation instead show.,"Luke Moore, Hailey Chavez",2022-12-05,Jacobson Ltd
Two gas window upon wall.,"Bradley Hamilton, Beth Douglas",2012-05-24,Ochoa Group
Total both leg realize serious.,"Andrew Lopez, Larry Alvarado",2021-11-21,"Martinez, Townsend and Harper"
Ready that rise major.,"Michael Ferguson, Tracy Wagner",2006-11-05,Miller LLC
Child want we ever radio.,"Kirk Brown, Vanessa Berry",2006-04-02,Sullivan-Stephens
Order affect leader campaign.,"Clarence Hernandez, Elizabeth Cooke",2009-09-14,Dillon LLC
Myself away learn big.,"Margaret Howard MD, Amanda Miller",2005-09-16,Patel PLC
Red book.,"Dr. Brian Marquez MD, Chelsea Bruce",2014-03-23,Christensen-Lee
Election these.,"Jesus King, Laura Deleon",2013-08-29,Johnson LLC
Join shake season.,"Mr. Billy Armstrong, Mary Hunt",2014-03-27,Harrell-Green
Moment follow five.,"Sandra Neal, Susan Hess",2008-11-03,Diaz-Cruz
Tend guess person.,"Elaine Garner, Sarah Galvan",2021-05-25,Dominguez-Franklin
Everyone authority way successful.,"Benjamin Adams, Timothy Bishop",2017-10-04,"Miller, Carey and Collins"
Matter religious charge.,"Melissa Shepard, David Taylor",2000-07-15,Novak-Williams
Hospital daughter.,"Kenneth Copeland, Richard Townsend",2017-10-04,Alexander-Richards
Cultural though worker.,"Sharon Phillips, Valerie Solis",2014-05-10,Hall-Clark
Mouth step step.,"Amy Clayton DVM, Michael Sandoval",2000-12-30,Ortega-Cunningham
Yeah white small listen.,"Theresa Torres, Joseph Jones",2014-01-09,Porter-Smith
Instead myself same fill.,"Mark Turner, Kimberly Landry",2004-10-27,Huff-Jordan
Determine about all.,"Erica Summers, Paul Cox",2001-03-07,"Hall, Rubio and Campbell"
Light word how.,"Mrs. Pamela Hall, Kathy Stephenson",2011-10-29,Davis and Sons
Space summer why fight.,"Dr. Debbie Vasquez MD, Christopher Collins",2011-01-05,Hart PLC
Nation or.,"Kevin Barry, Karen Martinez",2011-03-31,Brady-Ford
Fill start.,"Robert Long, Gregory Brown",2013-06-01,Whitaker LLC
Discuss cover make table.,"Ashley Gonzalez, Justin Martin",2005-04-12,Smith-Estrada
Large something set space.,"Anita Thomas, Donna Jones",2017-10-08,Johnson-Henry
Great buy why.,"Angela Bean, Danielle Cannon",2017-09-22,"Hart, Miller and Miller"
Including quite position land.,"Tracy King, Danielle Olson",2010-11-10,Davis-Nielsen
Keep song plant.,"Michele Wilson, Tom Schwartz",2019-03-07,"Reyes, Sanchez and Grimes"
Let late relationship common.,"Tracy Watson, Michael Romero",2000-03-31,"Mason, Brown and Barry"
Down for.,"Susan Zimmerman, Joseph Tucker",2008-02-09,King-Green
Rich professional still.,"Amy Brown, Olivia Huynh",2019-01-30,"Anderson, Osborne and Soto"
Me customer you wind.,"Jennifer Adams, Katherine Griffin",2007-04-28,Ferrell-Ortiz
Maintain development security.,"Timothy Haley, Lisa Beasley",2023-12-08,Richardson and Sons
Able yourself majority admit.,"Angel Singh, Sabrina Frey",2013-10-06,Bray-Harris
Building option occur assume such.,"Kevin Cooper, Michele Gonzales",2016-10-19,"Lewis, Brown and Wagner"
Performance even already Democrat major.,"Angela Thornton, Michelle Knox",2009-10-18,Stein-Buchanan
Team shake even.,"William Wilson, Amanda Mack",2016-12-31,"Martinez, Spencer and Roberson"
Event although together various.,"Matthew Jimenez, Crystal Walker",2002-11-14,Osborne-Rios
Poor degree learn work.,"Renee Terry, Veronica Romero",2017-08-02,Campos-Berger
Voice sort store.,"Ryan Buckley, Elizabeth Lopez",2010-03-17,Duke and Sons
This drug evidence staff among.,"Eric Meyers, Matthew Schultz",2005-10-09,Huynh Ltd
Cover final relationship.,"Thomas Morris, Juan Holmes",2019-05-18,Arnold Inc
Something church trouble.,"Taylor Bailey, Rebecca Hobbs",2003-03-30,Mendoza-Hahn
Offer room glass buy language.,"Donna Martin, Mark Walker",2017-09-24,"Cox, Conway and Meyer"
Scene next himself.,"Maria Graves, Sandra Ferguson",2000-11-25,Ramirez-Powell
Similar she.,"Melanie Morrison, William Mcgee",2013-08-07,"Allen, Taylor and Gross"
Old affect husband page know.,"David Edwards, Deborah Gray",2021-10-20,Mullins Inc
Research group myself year.,"Miss Renee Griffin, Joseph Garcia",2013-11-19,"Brennan, Barnes and Gonzalez"
Morning become game.,"Shane Alvarado, Dawn Parker",2014-04-26,Wong PLC
Opportunity growth.,"Hailey Johnson, Anthony Lucas",2004-12-31,Bradley Inc
Decision father sort.,"Ryan Lucas, Angelica Stone",2001-08-24,Ray PLC
Word throw.,"Michelle Santos, Eric Duran",2022-08-09,Ford Ltd
Attorney take evidence cell play.,"Susan Mendoza, Anthony Martinez",2004-09-01,"Morris, Warren and Jones"
Consider door measure point.,"Jessica Weeks, Connie Armstrong",2016-05-25,Odonnell Ltd
Picture save better until.,"Melissa Dean, James Gonzalez",2021-07-31,Jones-Dixon
Woman increase.,"Elaine Jones, John Walker",2020-04-03,Joseph-Gomez
Much eye.,"Christine Stokes, Daniel Cooper",2002-04-23,Jackson-Glover
Kitchen station speech.,"Sarah Phillips, Joseph Collins",2025-01-30,Bush-Smith
Interest news technology.,"Billy Stuart, Nicholas Hubbard",2017-08-09,"Rojas, Carter and Fuller"
Capital general remain.,"Christina Ballard, Teresa Alexander",2012-01-31,"Meyer, Harmon and Mills"
Send on visit perform challenge.,"Andrew Parker, Bryan Young",2001-07-10,"Newton, Holloway and Diaz"
Develop between own it.,"Stephanie Serrano, Natalie Meza",2001-03-17,"Bowen, Peterson and Adams"
Eight increase in writer.,"Linda Mcdaniel, Alejandro Nichols",2007-06-06,Stewart Group
Mind behavior.,"Michelle Bender, David Gallegos",2002-03-15,Brown LLC
Discover student.,"Lee Jenkins, Natalie Lewis",2016-07-09,Schneider Inc
Exist other cell.,"Jennifer Morris, Rebecca Nguyen",2011-01-16,Chang-Roberts
Together represent.,"Robert Hansen, Mary Hahn",2001-04-01,Hamilton-Wheeler
Set example question positive hit.,"Dawn Baker, Paul Perry",2013-04-12,"Williams, Ellis and Munoz"
Within probably major figure fine.,"Timothy Thomas, Christine Nelson",2003-06-17,Cox-Mendez
Summer lose manage.,"Melinda Fernandez, Heather Gonzalez",2006-04-11,"Johnson, Collins and Gomez"
Trade build speak.,"Kathryn Campbell, Thomas Long MD",2008-07-17,"Lee, Gould and Spears"
Exist step line standard reveal.,"Charles Rocha, Luke Price",2014-01-07,"Carpenter, Abbott and Schultz"
Specific grow film.,"James Elliott, Pamela French",2020-07-29,Harris-Lee
Power image occur example.,"Rose Harris, Eric Zuniga",2019-08-07,Schroeder-Deleon
Note religious weight fly.,"Sharon Wallace, Daniel Watson",2010-07-24,Dillon-Rojas
Whole system reduce.,"Shawn Castro, Kevin Drake",2022-10-14,Everett-Vang
Group seek become agree check.,"Denise Stone, Ryan Wilson",2004-12-04,Smith-Barnes
Fall show choice fund.,"Michael Ramos, Eric Fitzpatrick",2007-05-21,"Wilson, Ortiz and Clark"
Try space whom sense.,"Katherine Martinez, Angela Romero",2005-12-08,Brown-Johnston
Member along rise threat.,"Laura Wade, Cesar Barnett",2023-11-02,Reed-Harvey
Early way subject size main.,"Jessica Parrish, David Schneider",2023-09-05,"Barr, Williams and Gaines"
Light huge money movie.,"William Riley, Chad Davis",2010-08-15,Cobb-May
Item food.,"Gregory Pierce, William Castro",2000-12-07,Fields PLC
Mother contain.,"Colleen Vargas, Jonathan Ward",2018-12-16,"Sanchez, Atkinson and Cannon"
