Title,Author(s),Published Date,Publisher
To detail.,"Matthew Holmes, William Johnson",2007-06-05,Matthews-Kim
Man almost entire run concern.,"Heidi Ross, Christopher Moyer",2009-10-04,"Black, Jackson and Lee"
Company against check there.,"Kendra Brown, Mark Mcclain",2021-08-07,Kennedy Inc
Lay up this.,"Amy Meyers, Troy Hoffman",2016-03-27,Alvarado Inc
Decade every sense recent character.,"Mr. Tony Bush, Deborah Barry",2004-01-19,"Reeves, Lewis and Hopkins"
Job put pressure.,"Nathan Hoover, Lauren Cordova",2015-04-10,"King, Hansen and Gray"
Nearly degree raise factor.,"Terri Walker, Anthony Roman",2021-11-09,Ortiz-Vance
Thought girl above listen.,"Wesley Mccall, Harold Smith",2004-09-12,Mcmillan and Sons
Organization better even.,"Kristi Nichols, Craig Rivera",2005-09-20,Ford-Thompson
Memory you present.,"Julie Rogers, Christopher Martinez",2024-05-28,Rogers-Cook
Next soon class since.,"Nichole Miller, Steven Robinson",2021-10-04,"Norris, Nunez and Oliver"
Least talk event past.,"Kelly Li, Carmen Flynn",2014-02-08,Campbell PLC
While month think opportunity magazine.,"Christina Ball, Katherine Murphy",2015-05-22,Marshall-Rivera
Take interesting loss respond foot.,"Courtney Hardy, David Hart",2011-11-07,Smith-Moreno
Animal air happen war.,"Desiree Sherman, Timothy Cole",2011-03-24,Hernandez PLC
Job land.,"Christine Patel, Brian Strickland",2000-09-28,"Thompson, Dunn and Boyd"
Ok interest.,"Cameron Graham Jr., Steven Glenn",2020-06-27,Villegas-Morgan
Shoulder reduce involve ahead.,"Mariah Rice, Cheryl Sherman",2022-01-23,Deleon-Johnson
Media task do.,"Miss Jennifer Jordan, Heather Brown",2002-10-18,Smith-Jones
Strong list seat.,"Juan Gregory, Cory Le",2013-06-11,Ross Group
Yes test nation government hold.,"William Woods, Nicholas Brown",2013-12-02,Kirby Inc
Bring fire.,"Spencer Richardson, Mary Hardin",2023-04-06,"Dickson, Lester and Miller"
Past eye hair loss play.,"Jessica Ferguson, Latasha Dudley",2017-10-15,Munoz Group
Game education administration.,"Karen Hines, Steven Cobb",2017-05-02,"King, Willis and Reese"
Economy such better majority believe.,"David Clark, Elizabeth Carter",2004-01-05,Blanchard-Stewart
Night when somebody.,"Jennifer Simmons, Mark Howell",2022-08-09,"Hudson, Bell and Turner"
To lose pattern him behavior.,"Samantha Evans, Lori Small",2024-06-01,"Jones, Gilbert and Johns"
Generation line floor.,"Daniel Harris, Timothy Powell",2019-03-03,"Hernandez, Yu and Williams"
Former hour take role.,"Janet Morales, Mark Johnson",2016-02-20,Bradley Ltd
Technology positive dark.,"Amanda Choi, Kathy Hines",2005-11-09,Brown-Gould
Think long say born.,"John Johnson, Cody May",2013-01-14,Townsend and Sons
Course college.,"Stacey Miller, Krystal Martin",2013-01-21,"Weber, Hill and Conner"
Fight his outside.,"Vanessa Nelson, Diane Moreno",2022-07-07,Mcdonald-Bryant
Under husband become bad.,"Barbara Griffith, Jesse Hensley",2008-07-15,Lutz-Brennan
Should during writer.,"Tyler Moses, Caleb Clarke",2024-12-01,"Scott, Hill and Wilkins"
Society poor.,"Catherine Harrison, Regina Aguirre",2009-03-16,Baker-Mcdonald
Dinner lay trip address Mr.,"Roberto Kelly, Susan Sampson",2022-05-12,Hebert Group
Leader lose happen realize.,"Megan Gray, Dawn Booker",2023-12-13,Hardin-Allen
Like matter fly point.,"Melissa Gregory, Matthew Jordan",2018-10-15,"Hebert, Martinez and Cooper"
Nice use Mr provide.,"Diane Benson, Katherine Banks",2016-06-14,"Lewis, Foster and Wilson"
Walk method west.,"Sarah Phillips, Lauren Sullivan",2019-06-01,"Snyder, Brooks and Serrano"
Quality shoulder interesting hit your.,"Stephanie Thornton, Jermaine Prince",2007-10-25,Montoya-Payne
Billion security ground hundred.,"Ann Moore, David Vasquez",2016-10-23,"Kemp, Fox and Anderson"
Huge unit finally.,"John Miller, Billy Wright",2000-10-11,Robles-Mccarthy
Single put note from.,"Joel Watson, Samantha Schneider",2012-03-23,"Dyer, Bernard and Dominguez"
Act night.,"Alison Stevens, Maria Whitehead",2001-02-16,Green-Russo
Rule truth Congress.,"Zachary Andrade, John Walter",2013-04-15,Wilson Inc
Stop security.,"Tamara Hardin, Lori Martin",2013-08-06,"Johnson, Riley and Rodriguez"
Listen sense bag shake station.,"Jennifer Swanson, Bethany Perez",2012-09-11,Brooks Ltd
Good high language lead common.,"Trevor Lozano, Mary Taylor",2022-09-24,Robinson-Evans
Improve figure employee.,"Carrie Morales, Heidi Pierce",2012-04-14,"Lutz, Palmer and Savage"
Enjoy health artist air.,"David Meyer, Kelly Wright",2006-11-05,Fleming PLC
Another nature message Democrat.,"Laura Rodriguez, Maureen Ponce",2011-06-05,Mcgrath LLC
Of history visit order.,"Michelle Perez, Joshua Wilson",2010-02-20,Gonzalez PLC
Would fight hotel.,"Kayla Ferguson, Jessica Thompson",2013-02-27,Hernandez-Wheeler
Coach evidence left as.,"Lorraine Weeks, Sean Edwards",2024-03-12,"Young, Reilly and Clark"
Watch buy onto trouble.,"David Howard, Madison Alexander",2008-07-25,"Spencer, Snyder and Alvarado"
Gas design everyone.,"Kimberly Gardner, Abigail Rice",2021-02-01,Galvan Inc
Song only speak.,"Brandon Young, Miranda Payne",2021-11-10,Valentine-Ortiz
Although wish could.,"Tiffany Anderson, Charles Morgan",2021-06-03,Howard Ltd
Art local memory bed.,"Samantha Carrillo, Susan Miller",2014-10-10,Whitney and Sons
Week positive.,"Jane Frey, Jeffrey Flores",2002-03-07,Wu-Jones
Forward month.,"Carlos Berg, Alan Gonzalez",2008-09-22,Garcia PLC
She forget off wrong.,"Michelle Perry, Stacy Combs",2007-12-02,"Mcbride, Turner and Wolfe"
Nearly early.,"Billy Aguilar, Vanessa Perez",2007-01-06,"King, Fox and Lucas"
Law director.,"Kristi Lara, Jeffrey Williams",2022-01-29,Bell and Sons
Floor these measure everybody.,"Diane Sanchez, Nathan Green",2022-04-21,Fernandez Inc
And learn author research.,"Darlene Rodriguez, Thomas Martin",2004-07-07,Wood Group
Development bill receive.,"Courtney Clark, Ashley Simon",2024-09-10,Buchanan-Smith
A serious.,"Shirley Sharp, Roger Douglas",2000-06-12,Wood-Spencer
Maybe these develop benefit impact.,"Sabrina Wallace, John Rose",2008-04-05,Hendricks Group
Argue whether according.,"David Osborn, Sarah Reed",2023-10-29,Ashley Inc
Morning either environment since rich.,"Frank Griffith, Alexander Rodriguez",2006-11-13,Russell PLC
Image agreement another.,"Kimberly Johnson, Charles Mason",2009-04-05,Rogers Ltd
Throughout suffer exist dog.,"Elizabeth Ortiz, Kelsey Nash",2023-12-26,Holden-Johnson
Move other type.,"Daniel Maldonado, Jeremy Hill",2016-02-02,Villanueva-Cross
Respond care team national.,"Natalie White, Marissa Booth",2008-09-02,Padilla-Becker
Cost land.,"Frederick Hansen, Patricia Hayes",2022-08-12,"Warner, Baker and Sanchez"
Vote situation while expect.,"Nathan Collier, Brittney Hernandez",2007-11-26,Wilson LLC
Agree test them.,"Cassandra Anderson, Carol Brown",2022-03-06,Hopkins-Kim
Go red shoulder.,"Angel Harvey, Kimberly Roth",2024-04-07,Mendez-Watkins
Fear relationship pick class politics.,"Jason Fleming, Lauren Daniels",2013-02-17,Garza Inc
Here huge positive day employee.,"Casey Moreno, Monica Hall",2011-08-10,"Macdonald, Smith and Frey"
Her community.,"Christopher Green, Robert Rodriguez",2020-09-11,Lawson-Rosales
Control dog assume social.,"Kirk Atkins, Dennis Bishop",2005-01-20,"Pearson, Willis and Clay"
Effect oil and.,"Jared Nguyen, Thomas Bailey",2021-09-03,"Hicks, Stanley and Garcia"
Activity score.,"Morgan Anderson, Lucas Adams",2010-06-24,Yates-Anderson
Interesting partner bag enjoy security.,"Shannon Hernandez, Jimmy Gonzalez",2019-08-24,Boone PLC
Year brother.,"David Hernandez, Elizabeth Dalton",2002-03-29,Collins LLC
Whatever common.,"Mary Green, Kenneth Gomez",2021-04-02,"Stevenson, Williams and Roberts"
Vote standard war.,"Erica Davis, Robert Brown",2016-10-18,Murphy-Hodges
Away option support describe.,"Nicholas Mathis, Joe Landry",2018-08-03,Burns PLC
Quickly information image tough.,"Kelly Conrad, Kelly Lopez",2008-09-20,Neal-Wright
Able office.,"Ashley Meza, Felicia Lee",2024-08-27,Rangel Ltd
Prevent smile maybe.,"Terrence Villarreal, Michelle Gray",2020-10-29,Stanley and Sons
History reality require main population.,"Nicole Franco, Erik Villa Jr.",2008-10-13,"Ibarra, Jenkins and Kemp"
Spring large success national detail.,"Troy Riley, Nicholas Grant",2013-08-30,Brown Inc
Organization light father bag.,"Cody Gomez, Katherine Bowman",2020-07-26,Rogers PLC
Agency process side.,"Michael Copeland, Dennis Watson",2009-04-06,"Brown, Mathis and Taylor"
Hundred under subject little.,"Lori Schmidt, Ryan Wright",2016-09-09,"Roach, Phillips and Morris"
If behavior range choice.,"Michael Anderson, Melissa Spencer",2000-05-10,"Pennington, Griffith and Walker"
Age give evidence.,"Jenny Carr, Michelle Campbell",2015-12-06,"Marshall, Robbins and Holland"
Apply bag realize two.,"Carmen Kidd, Kyle Sullivan",2020-05-13,"Andersen, Hardy and Cowan"
Present structure head.,"Judy Jackson, Megan Marshall",2018-05-08,Young and Sons
Customer able everything growth.,"Andrea Ortiz, Jason Gill",2018-11-25,"Young, Rivera and Stout"
Likely class who thought cell.,"James Payne, Wendy Cox",2018-10-24,Hayes and Sons
More more score.,"Ruben Williamson, Kelly Pierce",2019-01-19,Young and Sons
Meeting one hand structure lay.,"Brittany Ross, Amanda Harvey",2003-03-28,Bullock-Clark
Somebody truth inside.,"Daniel Brown, Anthony Graves",2005-09-10,Gill Ltd
Yes not.,"Vicki Newman, Katie Hanson",2011-08-29,"Townsend, Anderson and Harris"
Either seat.,"Jesus Clay, Christine Johnson",2014-01-20,Terry-Baxter
Still side sit road respond.,"Doris Juarez, Donald Ayala",2008-03-11,Olsen-Adams
Clear reveal military.,"Renee Clark, Erika Bennett",2008-12-08,"Henry, Baker and Vasquez"
Toward risk game.,"Garrett Jones, Jesse Horne",2015-04-26,Neal and Sons
Economy mother.,"Jason Taylor, Deborah Wright",2003-01-09,"Barber, Pineda and Sullivan"
Tell west travel.,"Justin Duncan, Matthew Scott",2012-03-13,Vasquez-Thompson
Dream yet put officer.,"Matthew Baker, Rose Preston",2013-03-29,Gallegos-Wall
Mention Mr manager.,"Randy Bailey, William Steele",2012-07-26,Quinn and Sons
Arm sometimes treatment.,"Sean Savage, Lee Simpson",2009-02-03,"Carey, Parks and Small"
Kitchen world peace ahead together.,"Julia Mason, Stephen Smith",2017-02-17,Morrow and Sons
International region center door themselves.,"Jaime Mitchell DDS, Joseph Davis",2009-01-02,Rivera LLC
Lose chance billion visit.,"Dr. Kelly Jackson, Sabrina Pope",2005-10-04,"Romero, Mueller and Mosley"
Arrive each responsibility.,"Steven Andrews, Paul Simpson",2013-04-30,Hernandez-Perkins
School citizen receive.,"Maria Tucker, Joseph Hayes",2020-03-16,Carroll Group
National authority partner machine office.,"Mary Sullivan, Jean Mcmahon",2007-01-05,Clayton-Scott
Compare record.,"Jesse Ho, Julie Smith",2018-11-18,Richardson and Sons
Direction wall.,"Cody Smith, Debra Harris",2014-06-29,Velez-Allen
Set budget size.,"Jason Davis, Kayla Oliver",2024-07-16,Cabrera PLC
Drop reflect.,"Christopher Kennedy, Carolyn Anderson",2006-10-12,Berry Group
Claim off difference heavy former.,"Charles Brown, Ross Hebert",2019-10-14,"Lloyd, Clark and Jones"
All tonight nor.,"Douglas Ramos, Sean Bell",2006-01-10,Stephens PLC
Current because instead population compare.,"Lindsay Flowers, Amy Turner",2000-08-25,West-Campbell
Artist among the matter claim.,"Samuel Miller, Veronica Maxwell",2013-08-15,Riley-Garrison
Main risk over talk.,"Brad Sims, Marie Smith",2001-01-04,Ferrell Group
Federal sure.,"Pamela Mayo, Joseph Harris",2016-01-12,Cain Inc
You somebody our.,"Charles Ellis, Katie Bradshaw",2014-09-07,"White, Lee and Newman"
These thus hospital risk.,"Christopher Diaz, Jason Young",2011-05-31,Walsh LLC
Source drug offer.,"Kari Hernandez, Joseph Owen",2018-12-15,Lopez-Estrada
Church people bring firm.,"Rebekah Prince, Joe Mitchell",2008-12-25,Fuller-Carter
Require cut recently trial.,"Jesus Watkins, Joseph Lam",2005-06-25,"Callahan, Heath and Hill"
Way personal treat technology.,"Angelica Martinez, Gary Benton",2018-05-15,"Hernandez, Brown and Anderson"
Hot growth you enough.,"Joshua Johnson, Malik Bailey",2013-01-31,Griffith-Young
Past guess.,"Shannon Wilson, Brett Tapia",2015-09-13,Wilson-Greene
Suffer ask entire glass.,"Jason Ramirez, Austin Harrington",2022-03-15,"Buckley, Brown and York"
My fire need.,"Mr. John Rhodes, Megan Griffith",2009-07-26,Melton-Nunez
Treatment perform nearly.,"David Hill, Shelly Davenport",2019-02-24,"Hernandez, Guerrero and Bradley"
Water art audience.,"Olivia Garrett, Angela Baird",2015-07-19,Smith-Sanders
Plan add seem different.,"Sherry Hicks, Patrick Jones",2020-05-02,Smith-Holmes
Continue strong couple need.,"Brittany Bentley, Kyle Monroe",2007-06-12,Miller and Sons
Own table matter.,"Zachary Ayers, Justin Jones",2024-03-07,"Terry, Gonzales and Jones"
Police fly guy.,"Jennifer Hall, Amanda Bennett",2009-01-15,Kelly Inc
Place science power after.,"Madison Higgins, Nicole Allen",2011-11-10,Martin-Martinez
Exactly sit.,"George Coleman, Stephen Garcia",2010-12-13,Hernandez-Williams
Sing customer computer.,"Joshua Bernard, Stephen Schmidt",2017-07-28,Tucker Inc
Rock sometimes.,"Sandra Cruz, Pamela Hansen",2012-04-05,Reyes Inc
Concern imagine age seat body.,"Daniel Mcclain, Timothy Larsen",2006-12-18,Smith-Owens
Force ask value about.,"Charles Strickland, Andrew Middleton",2003-05-07,"Holt, Smith and Burke"
Without drug science why.,"Jaime White, Daniel Schmidt",2024-03-08,Shaffer Group
Seven born to.,"Tanya Kim, Janet Kelley",2011-12-15,"Osborne, Jenkins and Heath"
Important mind enjoy I.,"Anna Burns, Kim Banks",2000-04-04,"Kim, Cox and Garcia"
Fact present success.,"Walter Key, Carl Floyd",2014-12-21,Garcia Group
Discuss sport inside try.,"Tammy Torres, William Larsen",2006-06-07,Jones-Allen
Medical what decade decision.,"Kristen Myers, Christopher Ballard",2010-04-15,"Gibson, Estes and Higgins"
Article public sit.,"Dennis Hamilton, Philip Jones",2008-05-10,Turner-Price
Table realize.,"Karen Baker, Michael Sanchez",2017-01-07,Yoder PLC
History write whatever.,"Yvonne Andrade, Ryan Parsons",2023-09-08,Humphrey-Carey
Amount impact onto yet.,"Mrs. Kelly Wilson MD, David Jones",2015-01-03,"Mcdonald, Martinez and Walton"
Court sing late movie card.,"Jeffrey Barton, Trevor Ramos",2018-01-13,Griffith-Gray
Floor court will health amount.,"Mary Rios, Amy Guerrero",2009-06-11,"Nash, Gardner and Atkinson"
Yard left.,"Dr. Christie Matthews, Jacqueline Baxter",2018-06-26,Peck and Sons
Around pay.,"Gregory Mccullough, Michael Rice",2002-09-24,Brown Ltd
Record response open certainly.,"Yvonne Harrington, Melanie Lawson",2017-12-24,Matthews PLC
Room after language grow agree.,"Nicholas King, Megan Wolf",2013-06-03,"Gomez, Rivera and Price"
Economic writer girl continue.,"Jeremy Harvey, Kimberly May",2008-09-23,Phillips LLC
Almost fly safe.,"Jennifer Ho, Bradley Kramer",2022-09-02,Beck-Lynch
Beautiful five visit.,"Aaron Hall, Christopher Watson",2015-09-16,Wilson-Tran
Carry any begin say.,"Roy Marshall, Cynthia Wiley",2006-05-08,Ross and Sons
Before social live.,"James Wade, Julie Trevino",2010-06-25,Rice Inc
Bit unit shake.,"Angela Hanson, Angela Robbins",2015-04-30,Anderson-Ramirez
Recent listen quickly.,"Jessica Marshall, Lisa Fowler",2016-03-04,Carter-Nguyen
Offer the.,"Aaron Keller, Andrew Gray",2000-06-02,"Martinez, Lewis and Carson"
Maybe better player.,"Ashley Finley, David Armstrong",2003-10-17,Jacobs-Hendricks
Property its lawyer in increase.,"Dawn Reynolds, Kimberly Harris",2011-10-06,"Bolton, Richardson and Dougherty"
Serve begin simply.,"Erin Holden, Bradley Wilson",2021-02-21,"Anderson, Price and Allen"
Explain actually good oil.,"Ms. Aimee Ellis, Elizabeth Burnett",2021-03-18,Clark LLC
Beyond I for.,"Amy Coleman, Jessica Ramsey",2009-06-24,"Hall, Williams and Flores"
Send join sit.,"Justin Rangel, Jeffrey Jenkins",2007-12-22,"Ellis, Bell and Gross"
Challenge life decision.,"Danielle Carter, Samantha Baxter",2005-11-09,Delgado and Sons
Choose better national fill.,"Francis Oneill, Vanessa Gardner",2022-11-06,"Bailey, Mccann and Abbott"
Behavior effort position minute.,"Laura Johnson, Linda Brown",2016-10-24,"Horne, Young and Campbell"
Test tell detail form.,"Kaylee Obrien, Jacob Rojas",2009-09-23,"Gomez, Mccarthy and Wright"
Stage art as.,"Stephen Washington, Frederick Butler",2013-11-03,"Williams, Pope and Craig"
Then financial score.,"Joseph Mccormick, Chase Patel",2016-08-21,"Smith, Shannon and Montoya"
Happy campaign.,"Victor Holmes, Calvin Brown",2020-10-21,Martinez LLC
